{
  "name": "Aptabase",
  "description": "Open-source, privacy-friendly analytics for mobile, desktop and web apps. Self-hosted, with PostgreSQL for accounts and ClickHouse for events.",
  "category": "Analytics",
  "readme": "templates/aptabase/README.md",
  "links": [
    {"label": "Source", "url": "https://github.com/aptabase/aptabase"},
    {"label": "Self-hosting guide", "url": "https://github.com/aptabase/self-hosting"},
    {"label": "Documentation", "url": "https://aptabase.com/docs"}
  ],
  "services": [
    {
      "name": "postgres",
      "source": {
        "type": "image",
        "image": "ghcr.io/railwayapp-templates/postgres-ssl:15.19"
      },
      "variables": {
        "POSTGRES_USER": {
          "value": "aptabase",
          "description": "PostgreSQL role Aptabase connects as."
        },
        "POSTGRES_DB": {
          "value": "aptabase",
          "description": "Database Aptabase runs its migrations against."
        },
        "POSTGRES_PASSWORD": {
          "value": "${{secret(32, \"abcdefghijklmnopqrstuvwxyzABCDEFGHIJKLMNOPQRSTUVWXYZ0123456789\")}}",
          "description": "Generated on deploy. Alphanumeric only, because it is interpolated into an ADO.NET connection string."
        },
        "PGDATA": {
          "value": "/var/lib/postgresql/data/pgdata",
          "description": "Data directory inside the mounted volume."
        }
      },
      "volumes": [{"mountPath": "/var/lib/postgresql/data"}],
      "deploy": {
        "restartPolicyType": "ON_FAILURE",
        "restartPolicyMaxRetries": 10
      }
    },
    {
      "name": "clickhouse",
      "source": {
        "type": "repo",
        "repo": "jorgeferrarice/railway",
        "rootDirectory": "templates/aptabase/clickhouse",
        "branch": "main"
      },
      "variables": {
        "CLICKHOUSE_USER": {
          "value": "aptabase",
          "description": "ClickHouse user Aptabase connects as."
        },
        "CLICKHOUSE_PASSWORD": {
          "value": "${{secret(32, \"abcdefghijklmnopqrstuvwxyzABCDEFGHIJKLMNOPQRSTUVWXYZ0123456789\")}}",
          "description": "Generated on deploy. Alphanumeric only, because it is interpolated into an ADO.NET connection string."
        }
      },
      "volumes": [{"mountPath": "/var/lib/clickhouse"}],
      "deploy": {
        "restartPolicyType": "ON_FAILURE",
        "restartPolicyMaxRetries": 10
      }
    },
    {
      "name": "aptabase",
      "source": {
        "type": "image",
        "image": "ghcr.io/aptabase/aptabase@sha256:8efa3c0b451947c296410855666fb4ec8e812ddd15e4f236984284a6ad8510fe"
      },
      "variables": {
        "BASE_URL": {
          "value": "https://${{RAILWAY_PUBLIC_DOMAIN}}",
          "description": "Public URL of this instance. Used to build activation and OAuth callback links."
        },
        "AUTH_SECRET": {
          "value": "${{secret(32, \"abcdefghijklmnopqrstuvwxyzABCDEFGHIJKLMNOPQRSTUVWXYZ0123456789\")}}",
          "description": "Signs auth tokens. Changing it signs every user out."
        },
        "DATABASE_URL": {
          "value": "Server=${{postgres.RAILWAY_PRIVATE_DOMAIN}};Port=5432;User Id=aptabase;Password=${{postgres.POSTGRES_PASSWORD}};Database=aptabase",
          "description": "PostgreSQL connection string, over the private network."
        },
        "CLICKHOUSE_URL": {
          "value": "Host=${{clickhouse.RAILWAY_PRIVATE_DOMAIN}};Port=8123;Username=aptabase;Password=${{clickhouse.CLICKHOUSE_PASSWORD}}",
          "description": "ClickHouse connection string, over the private network. No Database keyword, so events land in the default database, as upstream expects."
        },
        "ASPNETCORE_HTTP_PORTS": {
          "value": "8080",
          "description": "Pinned so the declared target port and Kestrel's listener cannot drift apart."
        },
        "REGION": {
          "value": "SH",
          "description": "Self-hosted."
        },
        "SMTP_HOST": {
          "value": "",
          "description": "Optional. Without SMTP, the signup activation link appears in this service's deploy logs instead of an inbox.",
          "isOptional": true
        },
        "SMTP_PORT": {"value": "", "description": "Optional SMTP port.", "isOptional": true},
        "SMTP_USERNAME": {"value": "", "description": "Optional SMTP username.", "isOptional": true},
        "SMTP_PASSWORD": {"value": "", "description": "Optional SMTP password.", "isOptional": true},
        "SMTP_FROM_ADDRESS": {"value": "", "description": "Optional sender address for outbound email.", "isOptional": true},
        "OAUTH_GITHUB_CLIENT_ID": {"value": "", "description": "Optional GitHub sign-in.", "isOptional": true},
        "OAUTH_GITHUB_CLIENT_SECRET": {"value": "", "description": "Optional GitHub sign-in.", "isOptional": true},
        "OAUTH_GOOGLE_CLIENT_ID": {"value": "", "description": "Optional Google sign-in.", "isOptional": true},
        "OAUTH_GOOGLE_CLIENT_SECRET": {"value": "", "description": "Optional Google sign-in.", "isOptional": true}
      },
      "networking": {"http": {"targetPort": 8080}},
      "deploy": {
        "healthcheckPath": "/healthz",
        "healthcheckTimeout": 300,
        "restartPolicyType": "ON_FAILURE",
        "restartPolicyMaxRetries": 10
      }
    }
  ]
}
